label	news summary
negative	U.S. fines American Airlines, Delta for long tarmac delays American Airlines was fined $1 million and Delta Air Lines Inc $750,000 for violating federal rules barring lengthy tarmac delays at U.S. airports, the U.S. Transportation Department said on Thursday.
positive	Jaguar Land Rover to announce major UK investment: BBC Luxury carmaker Jaguar Land Rover, part of Tata Motors Ltd, is preparing to announce hundreds of millions of pounds worth of investment in Britain, the BBC reported on Friday.
negative	BNP Paribas to cut up to 2,500 jobs at its Belgian bank BNP Paribas reached an agreement with unions over a plan to cut as many as 2,500 jobs at its Belgian retail banking unit by 2021 as part of an effort to bring down costs.
negative	Volkswagen's flagship VW brand missed margin goal in 2018: Spiegel Volkswagen's flagship VW brand missed its margin target in 2018 as operating profits declined despite growth in top-line revenues at the German carmaker, news weekly Spiegel reported on Friday, citing unpublished figures.
positive	Gap shares surge 24 percent as Wall Street praises split Gap Inc shares surged as much as 24 percent on Friday as a number of Wall Street analysts lauded the company's decision to separate its better-performing Old Navy brand.
negative	Exclusive: Apollo bets on Clearway Energy, defying PG&E bankruptcy fallout Private equity firm Apollo Global Management LLC has amassed a 6 percent stake in Clearway Energy Inc, a renewable energy producer whose shares were hit after one of its customers filed for bankruptcy, people familiar with the matter said on Friday.
negative	Norway's Aker BP switching gears from M&A to exploration Norwegian oil and gas company Aker BP is switching emphasis from M&A toward exploration, taking a potentially riskier path to increase its resources after years when it has relied on acquisitions to add the bulk of its new barrels.
negative	Canada PM speaks to Trump about tariffs, sources see little progress Canadian Prime Minister Justin Trudeau spoke to U.S. President Donald Trump on Thursday about American tariffs on steel and aluminum, Trudeau's office said on Friday, but well-placed sources said there was little sign of progress.
neutral	Another Kroger unit to stop accepting Visa credit cards due to high fees U.S. supermarket chain Kroger Co on Friday said its Smith's Food and Drug Stores division will stop accepting Visa Inc's credit cards, starting April 3, because of excessive transaction fees.
positive	A day of reckoning for the ECB? The European Central Bank has downplayed a global slowdown for months, but it will finally take a tentative step next week to prop up the euro zone economy, signaling fresh stimulus to keep banks lending.
negative	Tesla debuts $35,000 Model 3, sees loss in first quarter Tesla Inc said on Thursday it would not be profitable in the first quarter, as it offered for the first time a $35,000 version of its Model 3 sedan and said its global sales would now be online-only, steps designed to increase demand and cut overhead costs for the electric vehicle maker.
neutral	EBay announces review of StubHub, Classifieds in deal with activists EBay Inc on Friday announced a review of its StubHub and eBay Classifieds businesses and said it would appoint two new directors to its board, as part of an agreement with activist investors to avert a proxy contest.
negative	EU states block putting Saudi Arabia, U.S. territories on dirty-money list European Union member states unanimously rejected on Friday a proposal to blacklist Saudi Arabia and four U.S. territories for lax controls on terrorism financing and money laundering, sources told Reuters.
negative	Glencore highlights trade as 'foremost risk', others growing Glencore said trade barriers are its "foremost risk", but climate, political, legal and other potential dangers have become more pressing for the mining and trading group.
negative	India's growth may decelerate further despite election spending Billions of dollars of pre-election spending by the Indian government and political parties in the next two months is unlikely to stop the nation's economy from slowing further, economists said.
neutral	Caesars bows to Icahn demands on board, sale still eyed U.S. casino operator Caesars Entertainment Corp has struck a deal with investor Carl Icahn that appoints three new directors to its board, although the billionaire hedge fund manager continues to press for a sale of the company.
negative	Euro zone's triple-A bond drought persists after ECB steps away High-grade euro zone debt remains scarce even though the European Central Bank has stopped its huge purchases of new bonds, intensifying concerns that banks will face future collateral shortages and highlighting the need for safe assets.
negative	Malaysia seeks $7.5 billion in reparations from Goldman Sachs: FT Malaysia is seeking $7.5 billion in reparations from Goldman Sachs Group Inc over its dealings with scandal-linked state fund 1MDB, the Financial Times (FT) reported on Friday, citing the finance minister.
neutral	JD.com CEO will not face assault charges in Minnesota Minnesota prosecutors will not charge the billionaire chief executive officer of China's JD.com Inc, Richard Liu, after he was accused of rape by a University of Minnesota student during a recent U.S. visit, authorities said on Friday.
negative	Nasdaq confirms bear market; economic worries sink Wall Street Wall Street stocks fell sharply in volatile trading on Friday, with the Nasdaq confirming it is in a bear market, as concerns of slowing economic growth led investors to flee stocks in high-valuation sectors such as technology and communication services.
neutral	Incoming Campbell Soup CEO Clouse to be paid up to $7.4 million in 2019 Campbell Soup Co said on Friday that incoming Chief Executive Mark Clouse, a food industry veteran, could be paid as much as $7.4 million in compensation for fiscal 2019.
negative	Nasdaq in bear market, first of the three major U.S. indexes The Nasdaq Composite Index confirmed on Friday it is in a bear market for the first time since 2008, underscoring fears that the longest bull run in history for U.S. stocks could soon be over.
negative	China's HNA in talks to sell Ingram Micro to Apollo Global: source HNA Group Co [HNAIRC.UL] is in talks to sell Ingram Micro Inc to private equity firm Apollo Global Management Llc , a source familiar with the matter said on Friday, as the Chinese conglomerate continues to scale back operations.
negative	Factbox: Past Nasdaq bear markets lasted long and cut deep On Friday, the Nasdaq Composite closed almost 22 percent below its record high daily close on Aug. 29, signaling a nearly nine-and-a-half year bull market run for the index ended in late summer.
neutral	Wells Fargo moves jobs abroad after U.S. layoffs, government says Wells Fargo & Co. has been hiring overseas after pledging to eliminate thousands of jobs, according to a Department of Labor investigation.
negative	Automakers boost Takata air bag recall completion rates Automakers in the United States repaired more than 7.2 million defective Takata air bag inflators in 2018, as companies have ramped up efforts to track down parts in need of replacement, a report from an independent monitor released on Friday said.
positive	Boeing heads for expected 2018 plane order victory over Airbus Boeing Co looked poised to beat European arch-rival Airbus for aircraft orders in 2018 by a wide margin after clinching billions of dollars in new business from Nigeria's Green Africa Airways and Saudi Arabia's flyadeal.
neutral	Goldman Sachs CEO to employees: our compliance is strong Goldman Sachs Group Inc Chief Executive David Solomon on Friday defended the bank against criticism of its compliance and oversight related to dealings with the sovereign wealth fund 1MDB, according to a message sent to employees obtained by Reuters.
negative	Dollar rallies from post-Fed losses as U.S. shutdown likely The dollar gained on Friday as investors sought the currency's safety amid persistent equity market volatility and a possible U.S. government shutdown.
neutral	Citi regional executives get new responsibilities in 2019 Citigroup Inc has divided up the roles of outgoing North America Chief Executive Bill Mills, according to an internal memo seen by Reuters.
positive	Williams soothes markets, says Fed listening and could change policy The Federal Reserve is listening to the concerns of markets and open to changing its policy views next year, one its most influential members said on Friday, even while he stood by plans for interest-rate hikes and further paring of the Fed's bond portfolio.
negative	Biotech swoon adds to Nasdaq's pain as bear market looms ever closer As the Nasdaq Composite continues to stumble its way toward a bear market, biotech shares are worsening the collapse of the tech-heavy index.
negative	U.S. third-quarter growth trimmed; business spending slowing The U.S. economy slowed slightly more than previously estimated in the third quarter and momentum appears to have moderated further in the fourth quarter, with new orders and shipments of manufactured capital goods falling in November.
negative	Global stock indexes slide as U.S. government shutdown looms World stock markets continued a week-long sell-off on Friday as the threat of a U.S. government shutdown and further hikes in U.S. borrowing costs compounded investor anxiety that global economic growth is slowing.
neutral	Exclusive: Mitsui, Saudi Aramco, Russia's RDIF in talks to buy Arctic LNG 2 stakes - sources Japan's Mitsui & Co Ltd , Russian sovereign wealth fund RDIF and Saudi Aramco are in talks to buy stakes in Novatek's Arctic LNG 2 project, with the size of the investments still to be decided, sources familiar with the talks told Reuters.
neutral	EU watchdog to rule on data exchange among market regulators The European Union's data watchdog will decide in coming weeks if financial regulators around the world can routinely swap information to keep markets clean without getting tangled up in the EU's new data protection regime.
positive	Nike shares rise as strong quarterly results allay China demand concerns Nike Inc shares rose 9 percent on Friday, after the company's solid quarterly results eased worries that escalating trade tensions between Washington and Beijing would weigh on China demand and hurt the sportswear maker's growth story.
negative	French court fines oil group Total in Iran bribery case A Paris court fined French oil and gas group Total 500,000 euros ($570,000) on Friday for bribing foreign public officials in a case related to Iranian contracts in 1997.
neutral	Zynga buys Empires & Puzzles gamemaker in largest deal to date (This corrects paragraph 7 of December 20 story to say Zynga acquired a unit of Peak Games, and not the entire company. The error also appeared in an earlier version)
negative	Lab-grown diamond prices slide as De Beers fights back Since De Beers abandoned its decades-old policy of refusing to sell lab-grown diamonds as jewelery, the price gap between man-made stones and natural gems has widened - and the difference is set to get even bigger.
negative	Exclusive: Global traders halt new Iran food deals as U.S. sanctions bite - sources Cargill, Bunge and other global traders have halted food supply deals with Iran because new U.S. sanctions have paralyzed banking systems required to secure payments, industry and Iranian government sources say.
negative	U.S. auto sales seen falling 1 percent in Dec - J.D. Power, LMC The pace of U.S. vehicle sales is set to slow for the sixth straight month in December despite aggressive discounts from manufacturers, according to industry consultants J.D. Power and LMC Automotive.
negative	U.S. third-quarter economic growth revised down to 3.4 percent The U.S. economy slowed in the third quarter a bit more than previously estimated, but the pace was likely strong enough to keep growth on track to hit the Trump administration's 3 percent target this year, even as momentum appears to have moderated further early in the fourth quarter.
neutral	Take Five: Bear-y Christmas! World markets themes for the week ahead Following are five big themes likely to dominate thinking of investors and traders in the coming week and the Reuters stories related to them.
negative	Political stumbles, savvy activists knock Canada's oil sector to its knees A decade ago, Canada's oil sector was growing so fast it was predicted to become a global energy superpower, but a series of political missteps and formidable environmental activism has created a dysfunctional system requiring OPEC-style government intervention to move its oil to market.
negative	Exclusive: Nigerian energy sector's crippling debts delay next power plant Plans to build another privately-financed power station in Nigeria to help end decades of chronic blackouts have been delayed because of concerns about persistent shortfalls in payments for electricity across the sector.
negative	Volkswagen to write off Gett investment - Spiegel German carmaker Volkswagen will write off its investment in Gett after the Israel-based ride hailing app failed to gain ground on bigger rivals Uber [UBER.UL], Lyft and Didi, weekly Der Spiegel reported on Friday.
negative	Ford recalling 874,000 pickup trucks in North America for fire risks Ford Motor Co said Friday it is recalling 874,000 pickup trucks in North America with engine block heaters for fire risks.
positive	Tencent shares spike as China watchdog flags video game approvals Tencent Holdings Ltd's shares surged on Friday after a local regulatory official said some new video games had been cleared for sale, ending a lengthy freeze in approvals that has spooked players in the world's largest gaming market.
negative	Futures extend slide on growth fears, government shutdown threat S&P 500 e-minis logged their biggest losing streak in seven years on Friday, dropping about 0.6 percent on growing worries of slowing global growth and the threat of a U.S. government shutdown.
positive	Foxconn to build $9 billion chip plant in China with local govt: Nikkei Taiwan's Foxconn , Apple Inc's iPhone assembler, is in the final stages of talks with the local government of the Chinese city of Zhuhai to build a chip plant there with a total investment of about $9 billion, the Nikkei business daily reported on Friday.
neutral	German retailer Kaufland drops Unilever products over price rises The German food retailer Kaufland on Friday said that it was dropping Unilever products from its shelves to protest against price increases.
neutral	Want to sue Venezuela for millions? These firms can help, for a price As Venezuela collapses, one little-known U.S. investment fund is poised to win big from litigation against its socialist government: Tenor Capital Management.
negative	Ghosn re-arrested on fresh allegations, likely to spend Christmas in detention Japanese prosecutors arrested Nissan Motor Co Ltd's ousted chairman Carlos Ghosn again on Friday on new allegations of making Nissan shoulder $16.6 million in personal investment losses, dashing chances he would be released on bail before Christmas.
neutral	Japan Inc exit from nuclear exports would leave field to Russia, China The possible withdrawal of Japanese conglomerates from nuclear export projects in Britain and Turkey would leave the nuclear newbuild industry open to Russian and Chinese state-owned companies as Western private firms struggle to compete.
positive	SoftBank's Vision Fund nearing $1.5 billion investment in SE Asia's Grab: source SoftBank Group Corp is nearing a deal to invest $1.5 billion in Grab, three times a previously expected $500 million, as Southeast Asia's biggest ride-hailing firm looks to expand, a person with knowledge of the matter said.
negative	Explainer: Arrested again: What are the new allegations against Nissan's Ghosn? Japanese prosecutors arrested Nissan's ousted chairman Carlos Ghosn for a third time on Friday, accusing him of aggravated breach of trust in transferring personal investment losses to the automaker.
neutral	Massages and free fish help east Europe tackle labor shortages What's does a company do when it doesn't have enough workers and unemployment rates are at record lows? In eastern Europe answers includes workplace massages, free carp for Christmas and guaranteed jobs for spouses.
neutral	Toshiba has no immediate plans to sell memory chip stake: CEO Toshiba Corp has no immediate plans to sell its 40.2 percent stake in Toshiba Memory Corp, its chief executive told Reuters, as the world's No. 2 producer of NAND flash memory chips prepares to go public within the next three years.
negative	Crude refusal: China shuns U.S. oil despite trade war truce China, the world's top oil importer, is set to start 2019 buying little or no crude from the United States despite a three-month truce in a trade scrap between the two nations, with relatively high freight costs and political uncertainty choking demand.
positive	China poised to buy more U.S. soybeans: sources China plans to make a third round of U.S. soybean purchases within days, two sources familiar with the matter said on Thursday, after a trade war truce between Washington and Beijing this month triggered two waves of buying.
negative	Exclusive: Bangladesh says to collect, test samples of Johnson & Johnson Baby Powder Bangladesh will collect and test samples of Johnson & Johnson's Baby Powder for asbestos in a couple of days, its main testing authority said on Friday, after a Reuters report last Friday that the firm knew for decades that cancer-causing asbestos could be found in the product.
neutral	Factbox: How man-made diamonds have grown to threaten natural gems The growing acceptance of man-made diamonds by millennials has spurred De Beers to reverse its policy of shunning the sector for jewelry and to launch its own laboratory-grown diamonds through its Lightbox jewelry brand.
neutral	Keeping on truckin': DHL seeks to counter driver shortages Faced with a chronic shortage of truck drivers, logistics firm Deutsche Post DHL Group is trialing a new scheme to get more people behind the wheel so it can keep goods flowing across Europe, especially at peak times like Christmas.
negative	Indian regulator orders J&J to stop using raw material to make Baby Powder in India India's drugs regulator has ordered Johnson & Johnson to stop manufacturing its Baby Powder using raw materials in two of its Indian factories until test results prove they are free of asbestos, a senior official said on Thursday.
negative	Dealmakers brace for slowdown after third-strongest M&A year Dealmakers celebrating their third-strongest year on record are fretting 2019 will herald a steep drop in mergers and acquisitions worldwide, as market jitters and economic uncertainty take their toll.
neutral	Mitsubishi seeks dismissal of Bombardier trade secrets case A trade secrets lawsuit brought by Canada's Bombardier Inc against the aircraft unit of Mitsubishi Heavy Industries Ltd should be dismissed because the allegations are baseless and designed to "disrupt development" of a rival jet, a spokesman for the Japanese company said on Thursday.
neutral	Vanguard CIO Buckley to take over as CEO from McNabb on Jan. 1 Vanguard Group, the world's largest mutual fund manager, said on Thursday Chief Executive Bill McNabb will step down at year end and be replaced by Chief Investment Officer Tim Buckley, betting on the internal successor to oversee rapid growth.
positive	Wall Street rises as financials lead before earnings Wall Street posted slight gains on Thursday and the Dow hit another record high close, with financials rising ahead of profit reports due Friday from several big U.S. banks.
neutral	CEO of Martin Shkreli's old company likens him to 'Pied Piper' The CEO of Retrophin Inc, the drug company that Martin Shkreli founded and is now accused of conspiring to defraud, compared Shkreli to the Pied Piper on Thursday as he tried to explain to jurors why he stuck with the company in its early days despite misgivings.
negative	Music streamer SoundCloud has cash until fourth quarter after layoffs SoundCloud, the world's biggest music-streaming service, is still struggling to find a business model - it now has enough cash to last until fourth quarter, after laying off 40 percent of its staff, a representative said on Thursday.
positive	U.S. energy secretary in Mexico eyes cooperation U.S. Energy Secretary Rick Perry promised on Thursday to promote cross-border electricity trade and investment with Mexico and said he expected talks aimed at updating the North American Free Trade Agreement (NAFTA) to proceed quickly.
neutral	FanDuel, DraftKings scrap troubled merger Daily fantasy sports companies FanDuel and DraftKings scrapped a plan to merge on Thursday following a legal challenge by U.S. antitrust enforcers.
positive	World shares rise to fresh peak; oil gains Upbeat data helped send world shares to a fourth all-time high in less than a month on Thursday as Wall Street edged higher in anticipation of solid earnings, while crude oil gained on evidence of stronger demand in China.
negative	Delta's profit tumbles on higher costs; passenger unit revenue rises Delta Air Lines Inc on Thursday reported a 21 percent drop in second-quarter profit because of sharply higher labor and fuel costs, despite higher passenger unit revenue, sending its shares down 2 percent.
positive	Boeing trade complaint won't slow CSeries deliveries: Delta CEO Delta Air Lines will not delay its 2018 deliveries of CSeries planes from Canada's Bombardier Inc , the carrier's chief executive said on Thursday, following an anti-dumping complaint by Boeing Co against the jets.
neutral	Trump Hotels discloses data breach at 14 properties Trump International Hotels Management LLC said late on Tuesday a data breach at a service provider compromised card payment details at 14 of its properties.
neutral	Disney agrees to sell Fox Sports in Brazil to win antitrust nod Walt Disney Co accepted a demand by Brazil's antitrust regulator CADE that it sell local rights for the Fox Sports channel to win approval of its takeover of Twenty-First Century Fox Inc, the regulator said on Wednesday.
neutral	Wells Fargo starts settlement talks with Justice Dept, SEC Wells Fargo & Co said on Wednesday that it entered preliminary settlement discussions with the U.S. Department of Justice and the Securities and Exchange Commission over previously disclosed probes into its sales practices.
positive	Southwest Airlines wins U.S. approval for Hawaii service Southwest Airlines Co said on Wednesday it won approval from the U.S. Federal Aviation Administration to begin flying to Hawaii from California, clearing the way for the low-cost carrier to move forward with a key part of its 2019 growth plan.
neutral	Wall Street steadies after Lighthizer, Powell, Cohen testimonies The S&P 500 closed down slightly on Wednesday but well above its session low after testimonies to U.S. Congress from trade and central bank officials as well as President Donald Trump's former lawyer brought few major surprises.
neutral	Disney in talks with AT&T to buy WarnerMedia's Hulu stake: Variety Walt Disney Co is actively pursuing the purchase of WarnerMedia's nearly 10 percent stake in Hulu, entertainment business news portal Variety reported on Wednesday, citing sources.
negative	Global stocks slip after U.S. trade official's comments but energy up Global stock indexes ended with mostly slight losses on Wednesday after U.S. Trade Representative Robert Lighthizer said it was too early to predict an outcome in U.S.-China trade talks, although a jump in oil prices lifted shares of energy companies.
neutral	How U.S. bike companies are steering around Trump's China tariffs (This Feb 26 story corrects data in paragraph 11 that was provided by Kent International comparing wages in China to the United States. Fixes typos in Kent chief executive's name in paragraph 24.)
neutral	Germany's Merck makes $5.9 billion counterbid for Versum German drugs and lab supplies maker Merck KGaA offered $5.9 billion, including debt, for Versum Materials, in a cash deal that tops an offer from U.S. rival Entegris, as both seek to boost their electrochemicals operations.
positive	FedEx partners with Walmart, Pizza Hut to test last-mile delivery robot FedEx Corp this summer plans to begin testing a robot to handle home deliveries for partners ranging from Walmart Inc to Pizza Hut.
positive	U.S. wants regular meetings to ensure trade deal enforcement: Lighthizer The United States wants meetings as regularly as once a month to ensure enforcement of any potential trade pact with China, U.S. Trade Representative Robert Lighthizer said on Wednesday.
neutral	Boeing seeks UK decision on Wedgetail jet buy this year: executive Boeing hopes Britain will decide this year on plans to buy E-7 Wedgetail early warning jets, an executive said, after talks last year sparked a row over competition in arms procurement.
neutral	JPMorgan hires commercial bankers, leaders across Europe, Asia JPMorgan Chase & Co on Wednesday named half a dozen people to a commercial banking team in Europe and new international and Asia-Pacific regional leaders, as the U.S. bank closes in on business clients it hopes to poach from rivals abroad.
positive	Oil rises 2 percent as U.S. crude stocks plunge, OPEC brushes off Trump Oil futures gained about 2 percent on Wednesday after U.S. crude inventories unexpectedly plummeted and as Saudi Arabia brushed aside comments from U.S. President Donald Trump seeking to keep oil prices from climbing.
